{"schemaVersion":"0.1","projectId":"PRJ-STANDARD-001","title":"Organizador de projetos","mode":"STANDARD","originalIdea":"Quero organizar meus projetos e saber sempre o próximo passo.","problem":"Projetos ficam sem próximo passo claro.","audience":"Pessoa que conduz vários projetos individuais.","hypothesis":{"statement":"Um estado estruturado com dependências torna o próximo passo mais claro.","minimumTest":"Acompanhar três projetos por uma semana.","metric":"Sessões que terminam com ação clara.","threshold":"Pelo menos 80%.","evidenceStatus":"NOT_TESTED"},"scope":{"mvp":["Criar projetos","Registrar etapas","Mostrar próximo passo"],"outOfScope":["Colaboração","Automação"]},"decisions":[{"id":"DEC-001","text":"A primeira versão é de uso individual.","author":"USER","authority":"USER","state":"LOCKED","commitment":"LOCKED","lockAction":"HUMAN_EXPLICIT","rationale":"Evita antecipar colaboração."},{"id":"DEC-002","text":"O próximo passo deriva do estado conhecido.","author":"USER","authority":"USER","state":"REFINING","commitment":"ACCEPTED","lockAction":"NONE","rationale":"Mantém a regra revisável."}],"requirements":[{"id":"REQ-001","text":"Criar projetos e registrar etapas.","acceptance":["Etapas sobrevivem à reabertura."],"rationale":"Base do próximo passo.","decisionRefs":["DEC-001"]},{"id":"REQ-002","text":"Mostrar próxima ação explicável.","acceptance":["A ação e o motivo são exibidos."],"rationale":"Promessa central.","decisionRefs":["DEC-002"]}],"roadmap":[{"id":"PHASE-001","text":"Captura e estado.","verify":"Criar e reabrir projeto.","gateStatus":"NOT_RUN"},{"id":"PHASE-002","text":"Próximo passo.","verify":"Inspecionar ação e motivo.","gateStatus":"NOT_RUN","dependsOn":["PHASE-001"]}],"gaps":[{"id":"GAP-001","text":"Explicação ainda não foi avaliada em uso real.","severity":"HIGH","status":"UNKNOWN"}],"gates":[{"id":"GATE-CORE","status":"NOT_RUN","rationale":"Fixture de contrato."}],"references":[],"integrity":{"contentHash":"fixture-standard","hashAlgorithm":"SHA-256"},"knownLimitations":["Colaboração e automação ficam fora do recorte."]}
